[
  {
    "schema_version": "1.0",
    "id": "20260907-ninfer-windows-tp2-base_mtp0_r1",
    "timestamp_utc": "2026-09-07T16:42:08+00:00",
    "source": {
      "type": "community",
      "label": "community-2x5060ti-ivanov84-ninfer-windows-tp2",
      "url": "https://github.com/5p00kyy/club-5060ti/issues/8",
      "notes": "Normalized by the maintainer from the contributor fork raw CSV and methodology at commit eb01f69; submitted by an AI agent on behalf of Dmitriy Ivanov."
    },
    "promotion_level": "benchmark",
    "tier": "capable",
    "hardware": {
      "lane": "2x5060ti",
      "gpu_count": 2,
      "gpu_model": "RTX 5060 Ti",
      "vram_per_gpu_gb": 16.0,
      "driver": "581.57",
      "cpu": "Intel Core i3-12100F",
      "host_ram_gb": 64.0,
      "pcie": "GPU0 CPU-attached PCIe 5.0 x8 under load; GPU1 chipset PCIe 3.0 x4; no CUDA P2P",
      "notes": "MSI PRO Z690-A; native Windows 11 x64 under WDDM."
    },
    "runtime": {
      "engine": "other",
      "version": "NInfer Windows-TP2 experiment",
      "commit": "eb01f69c5880ca20658e9fd0645ed20d18cc0e05",
      "notes": "NInfer TP2 with CUDA-graph decode and pinned write-back host-memory peer mailbox; canonical post-revert binary."
    },
    "model": {
      "id": "qwen3_8_27b_nvfp4.ninfer",
      "family": "Qwen3.8",
      "architecture": "hybrid",
      "parameter_class": "27B",
      "quant": "NVFP4",
      "source": "Published NInfer Qwen3.8-27B NVFP4 artifact, SHA-256 verified by contributor."
    },
    "serving": {
      "route": "cli",
      "context_tokens": 8192,
      "kv_cache_k": "bf16",
      "kv_cache_v": "bf16",
      "tensor_parallel": "2",
      "speculation": {
        "type": "mtp",
        "draft_n": 0
      },
      "thinking": "off",
      "launch": "--tp 2 --devices 0,1 --max-context 8192 --kv-capacity auto --no-thinking --ignore-eos",
      "notes": "CUDA graphs enabled. Small fixed-shape allreduces use the pinned-host mailbox; eager/prefill and oversized payloads retain the staged fallback."
    },
    "benchmark": {
      "prompt_set": "custom",
      "configured_context_tokens": 8192,
      "actual_prompt_tokens": 19,
      "generated_tokens": 512,
      "runs": 1,
      "warmups": 0,
      "stream": false,
      "cache_policy": "server-default",
      "notes": "Engine-committed decode throughput; greedy temperature 0; output-limit finish. Raw run id: base_mtp0_r1."
    },
    "metrics": {
      "decode_tok_s": 35.73,
      "prompt_tok_s": 45.05,
      "wall_seconds": 14.32
    },
    "caveats": [
      "Community-submitted Windows 11 result; not independently reproduced by the maintainer.",
      "Single request with a short synthetic prompt; decode speed and MTP acceptance are workload-dependent.",
      "Native Windows/WDDM mailbox transport result; no matched Linux comparison was measured on this machine.",
      "Prefill numbers use a tiny prompt and should not be treated as sustained long-prompt throughput."
    ],
    "artifacts": [
      "https://github.com/ivanov84/ninfer-windows-tp2/blob/eb01f69c5880ca20658e9fd0645ed20d18cc0e05/benchmarks/windows-tp2-phase2c.csv",
      "https://github.com/ivanov84/ninfer-windows-tp2/blob/eb01f69c5880ca20658e9fd0645ed20d18cc0e05/benchmarks/windows-tp2-benchmarks.md",
      "https://github.com/ivanov84/ninfer-windows-tp2/blob/eb01f69c5880ca20658e9fd0645ed20d18cc0e05/docs/windows-peer-mailbox.md"
    ]
  },
  {
    "schema_version": "1.0",
    "id": "20260907-ninfer-windows-tp2-base_mtp0_r2",
    "timestamp_utc": "2026-09-07T16:42:08+00:00",
    "source": {
      "type": "community",
      "label": "community-2x5060ti-ivanov84-ninfer-windows-tp2",
      "url": "https://github.com/5p00kyy/club-5060ti/issues/8",
      "notes": "Normalized by the maintainer from the contributor fork raw CSV and methodology at commit eb01f69; submitted by an AI agent on behalf of Dmitriy Ivanov."
    },
    "promotion_level": "benchmark",
    "tier": "capable",
    "hardware": {
      "lane": "2x5060ti",
      "gpu_count": 2,
      "gpu_model": "RTX 5060 Ti",
      "vram_per_gpu_gb": 16.0,
      "driver": "581.57",
      "cpu": "Intel Core i3-12100F",
      "host_ram_gb": 64.0,
      "pcie": "GPU0 CPU-attached PCIe 5.0 x8 under load; GPU1 chipset PCIe 3.0 x4; no CUDA P2P",
      "notes": "MSI PRO Z690-A; native Windows 11 x64 under WDDM."
    },
    "runtime": {
      "engine": "other",
      "version": "NInfer Windows-TP2 experiment",
      "commit": "eb01f69c5880ca20658e9fd0645ed20d18cc0e05",
      "notes": "NInfer TP2 with CUDA-graph decode and pinned write-back host-memory peer mailbox; canonical post-revert binary."
    },
    "model": {
      "id": "qwen3_8_27b_nvfp4.ninfer",
      "family": "Qwen3.8",
      "architecture": "hybrid",
      "parameter_class": "27B",
      "quant": "NVFP4",
      "source": "Published NInfer Qwen3.8-27B NVFP4 artifact, SHA-256 verified by contributor."
    },
    "serving": {
      "route": "cli",
      "context_tokens": 8192,
      "kv_cache_k": "bf16",
      "kv_cache_v": "bf16",
      "tensor_parallel": "2",
      "speculation": {
        "type": "mtp",
        "draft_n": 0
      },
      "thinking": "off",
      "launch": "--tp 2 --devices 0,1 --max-context 8192 --kv-capacity auto --no-thinking --ignore-eos",
      "notes": "CUDA graphs enabled. Small fixed-shape allreduces use the pinned-host mailbox; eager/prefill and oversized payloads retain the staged fallback."
    },
    "benchmark": {
      "prompt_set": "custom",
      "configured_context_tokens": 8192,
      "actual_prompt_tokens": 19,
      "generated_tokens": 512,
      "runs": 1,
      "warmups": 0,
      "stream": false,
      "cache_policy": "server-default",
      "notes": "Engine-committed decode throughput; greedy temperature 0; output-limit finish. Raw run id: base_mtp0_r2."
    },
    "metrics": {
      "decode_tok_s": 35.77,
      "prompt_tok_s": 45.05,
      "wall_seconds": 14.3
    },
    "caveats": [
      "Community-submitted Windows 11 result; not independently reproduced by the maintainer.",
      "Single request with a short synthetic prompt; decode speed and MTP acceptance are workload-dependent.",
      "Native Windows/WDDM mailbox transport result; no matched Linux comparison was measured on this machine.",
      "Prefill numbers use a tiny prompt and should not be treated as sustained long-prompt throughput."
    ],
    "artifacts": [
      "https://github.com/ivanov84/ninfer-windows-tp2/blob/eb01f69c5880ca20658e9fd0645ed20d18cc0e05/benchmarks/windows-tp2-phase2c.csv",
      "https://github.com/ivanov84/ninfer-windows-tp2/blob/eb01f69c5880ca20658e9fd0645ed20d18cc0e05/benchmarks/windows-tp2-benchmarks.md",
      "https://github.com/ivanov84/ninfer-windows-tp2/blob/eb01f69c5880ca20658e9fd0645ed20d18cc0e05/docs/windows-peer-mailbox.md"
    ]
  },
  {
    "schema_version": "1.0",
    "id": "20260907-ninfer-windows-tp2-base_mtp1",
    "timestamp_utc": "2026-09-07T16:42:08+00:00",
    "source": {
      "type": "community",
      "label": "community-2x5060ti-ivanov84-ninfer-windows-tp2",
      "url": "https://github.com/5p00kyy/club-5060ti/issues/8",
      "notes": "Normalized by the maintainer from the contributor fork raw CSV and methodology at commit eb01f69; submitted by an AI agent on behalf of Dmitriy Ivanov."
    },
    "promotion_level": "benchmark",
    "tier": "capable",
    "hardware": {
      "lane": "2x5060ti",
      "gpu_count": 2,
      "gpu_model": "RTX 5060 Ti",
      "vram_per_gpu_gb": 16.0,
      "driver": "581.57",
      "cpu": "Intel Core i3-12100F",
      "host_ram_gb": 64.0,
      "pcie": "GPU0 CPU-attached PCIe 5.0 x8 under load; GPU1 chipset PCIe 3.0 x4; no CUDA P2P",
      "notes": "MSI PRO Z690-A; native Windows 11 x64 under WDDM."
    },
    "runtime": {
      "engine": "other",
      "version": "NInfer Windows-TP2 experiment",
      "commit": "eb01f69c5880ca20658e9fd0645ed20d18cc0e05",
      "notes": "NInfer TP2 with CUDA-graph decode and pinned write-back host-memory peer mailbox; canonical post-revert binary."
    },
    "model": {
      "id": "qwen3_8_27b_nvfp4.ninfer",
      "family": "Qwen3.8",
      "architecture": "hybrid",
      "parameter_class": "27B",
      "quant": "NVFP4",
      "source": "Published NInfer Qwen3.8-27B NVFP4 artifact, SHA-256 verified by contributor."
    },
    "serving": {
      "route": "cli",
      "context_tokens": 8192,
      "kv_cache_k": "bf16",
      "kv_cache_v": "bf16",
      "tensor_parallel": "2",
      "speculation": {
        "type": "mtp",
        "draft_n": 1,
        "acceptance_rate": 87.5
      },
      "thinking": "off",
      "launch": "--tp 2 --devices 0,1 --max-context 8192 --kv-capacity auto --no-thinking --ignore-eos",
      "notes": "CUDA graphs enabled. Small fixed-shape allreduces use the pinned-host mailbox; eager/prefill and oversized payloads retain the staged fallback."
    },
    "benchmark": {
      "prompt_set": "custom",
      "configured_context_tokens": 8192,
      "actual_prompt_tokens": 19,
      "generated_tokens": 512,
      "runs": 1,
      "warmups": 0,
      "stream": false,
      "cache_policy": "server-default",
      "notes": "Engine-committed decode throughput; greedy temperature 0; output-limit finish. Raw run id: base_mtp1."
    },
    "metrics": {
      "decode_tok_s": 57.71,
      "prompt_tok_s": 50.25,
      "wall_seconds": 8.86
    },
    "caveats": [
      "Community-submitted Windows 11 result; not independently reproduced by the maintainer.",
      "Single request with a short synthetic prompt; decode speed and MTP acceptance are workload-dependent.",
      "Native Windows/WDDM mailbox transport result; no matched Linux comparison was measured on this machine.",
      "Prefill numbers use a tiny prompt and should not be treated as sustained long-prompt throughput."
    ],
    "artifacts": [
      "https://github.com/ivanov84/ninfer-windows-tp2/blob/eb01f69c5880ca20658e9fd0645ed20d18cc0e05/benchmarks/windows-tp2-phase2c.csv",